{
  "schema_version": 2,
  "id": "oracle-core-check",
  "title": "Multi-Oracle core scenario and Replay flake gate",
  "family": "foundation-oracle",
  "owner": "evaluation",
  "risk": "P0",
  "driver": "command",
  "provider_mode": "recorded",
  "workspace": ".",
  "fixture_id": "oracle-core-check-v2",
  "expected_facts": [
    "oracle_negative_controls_checked",
    "impact_selection_fail_closed"
  ],
  "turns": [],
  "faults": [],
  "oracles": [
    "command_verification"
  ],
  "required_evidence": [
    "command_result"
  ],
  "required_mutations": [],
  "cleanup_contract": "command-process-tree-v2",
  "run_plan": {
    "attempts": 1,
    "collect_all_group": "foundation-oracle"
  },
  "budgets": {
    "wall_time_ms": 300000,
    "max_attempts": 1,
    "max_output_bytes": 1048576
  },
  "requirements": {
    "commands": [
      "git",
      "go"
    ],
    "platforms": [
      "darwin",
      "linux",
      "windows"
    ],
    "capabilities": []
  },
  "execution": {
    "command": [
      "go",
      "run",
      "./evaluation/cmd/codehelper-eval",
      "oracle",
      "check",
      "--root",
      ".",
      "--pack",
      "evaluation/scenarios/core/pack.json",
      "--impact-map",
      "evaluation/impact-map.json",
      "--corpus",
      "evaluation/corpus",
      "--minimum",
      "30",
      "--replay-runs",
      "500"
    ],
    "working_directory": "."
  },
  "tags": [
    "oracle",
    "core-scenarios",
    "replay",
    "hermetic"
  ]
}
